<?xml version="1.0" encoding="UTF-8"?>
<!-- ex03-5 XML -->
<booklist xmlns:xsi="http://www.w3.org/2001/XMLSchema-instance"
    xsi:noNamespaceSchemaLocation="textbook.xsd">
    <book ISBN="966-788-611-147-9">
        <bookTitle>DBMS Using SQL Server 2015</bookTitle>
        <pubDate>2015-08-30</pubDate>
        <authorlist>
            <author>潔西卡</author>
        </authorlist>
        <price>NT780</price>
    </book>
    <book ISBN="966-788-622-146-5">
        <bookTitle>Java 8 語言入門</bookTitle>
        <pubDate>2015-07-12</pubDate>
        <authorlist>
            <author>威爾遜</author>
        </authorlist>
        <price> NT 700</price>
    </book>
    <book ISBN="966-788-244-127-2">
        <bookTitle>Java 8 語言指引</bookTitle>
        <pubDate>2015-11-25</pubDate>
        <authorlist>
            <author>尼爾森</author>
        </authorlist>
        <price> NT 750</price>
    </book>
</booklist>